Date,News
2024-12-05,"PETALING JAYA: An Industrial Court has upheld the sacking of a Maybank clerk who accessed her former husband’s bank account without his consent, saying the stern action will instil public confidence in financial institutions. The 36-year-old claimant was dismissed on Aug 17, 2022, following a domestic inquiry which found her guilty of unauthorised access of the accounts of her ex-husband and 23 others following a probe. Kuala Lumpur Industrial Court chairman Augustine Anthony said the court was mindful of the numerous public complaints about data breaches which have caused loss and misery to many innocent people. “Unauthorised banking transactions are a source of tremendous worry where people’s life savings have sometimes been lost due to various scams and cybercrimes. This court is also aware that mobile devices play a very significant role in the online and internet banking system. “Conscious of this role, financial institutions are investing heavily in risk management with a view to securing the safety and integrity of customers’ personal data and information. All these efforts will be futile if employees disregard strict banking policies and standard operating procedures,” he said in an award delivered last month. Anthony said Maybank began investigations after the claimant’s husband lodged a complaint in April 2022. The court heard that the couple divorced in 2021 and that the claimant, who had served Maybank for 15 years, had accessed his account even after their separation. Anthony said the claimant had kept screenshots of transactions involving 23 other account holders in her handphone, which her ex-husband submitted to the bank to facilitate the probe. The court said it could not accept the claimant’s testimony that she had her ex-husband’s consent to access his account. “It is not believable in light of the former husband’s complaint to the bank. “In any event, at the time the claimant accessed his banking account, they were divorced. Based on the claimant’s own evidence, their relationship had become so acrimonious that it is not believable that the complainant would have given her his consent,” the award read. Anthony commended Maybank’s counsel HR Dipendra for exercising restraint when cross-examining the claimant, saying the lawyer was exceedingly professional and courteous for asking only the most relevant questions in view of the sensitive nature of the dispute. The court also described the claimant’s action in submitting four letters purportedly issued by customers granting her consent to access their accounts “strange” since they were all dated one day after she was issued a show-cause letter by the bank. “None of these letters were produced by the claimant during the show cause and investigative stage.” The claimant’s excuse that she had forgotten to do so due to the stress she was under is unacceptable, said Anthony. “This was a clear afterthought designed in preparation for the case,” he said. In any case, he said the claimant had, in breach of the bank’s policy and procedures, failed to obtain the requisite consent before accessing the accounts. Anthony said the conduct of the claimant had exposed the bank to serious consequences. He said the claimant’s conduct of retaining the customers’ information in her mobile device was a clear breach of her employment contract and a serious misconduct that warranted her dismissal. Dipendra and Nur Azmina Izzati appeared for Maybank, while Naveen Joshua Solomon and P Kirthika represented the claimant."
2024-11-30,"KUALA LUMPUR: Affin Bank, Maybank and CIMB Group have announced flood relief programmes to help those affected by the floods. CIMB said it would provide six-month relief on loan and financing repayments, and waive late charges and fees. The relief applies to individual and small business customers, Bernama reported. Small businesses who need additional cash flow assistance can apply for a disaster relief facility of up to RM700,000 at a preferential financing rate, CIMB said. The banking group said it would distribute RM2.5 million for on-ground flood relief efforts as well as post-flood support. Maybank will defer loan and financing repayments, reduce monthly instalments or extend repayment tenure. The bank would also waive fees and charges for selected services, such as replacement of debit cards, ATM cards or cheque books. Affin Bank said it was offering financial relief on a variety of loans and financing products through its natural disaster relief programme."
2024-11-12,"KUALA LUMPUR: Malayan Banking Bhd (Maybank) is considering options including buying out Ageas SA’s minority stake in Etiqa as Malaysia’s biggest lender seeks to boost the value of the Southeast Asian insurer, according to people with knowledge of the matter. Maybank, as the Kuala Lumpur-listed lender is known, may also seek to replace Belgium insurer Ageas with another minority investor, said the people, asking not to be identified as the deliberations are private. Maybank owns 69% of Etiqa, while Ageas holds the remaining 31%. “A potential deal could value Etiqa at as much as US$4 billion (RM17.73 billion),” the people said. “Other options include renegotiating existing bancassurance agreements to help distribute insurance products,” they added. “Deliberations are ongoing and no final decisions have been made,” the people said, adding that Maybank could decide against pursuing any transaction. Representatives for Maybank, Ageas and Etiqa declined to comment. “Etiqa is profitable and has the potential to grow in Malaysia and the region,” Maybank CEO Khairussaleh Ramli said in an interview last year. He also ruled out a potential listing of the insurer. With more than 10,000 agents and 44 branches, Etiqa offers both conventional and shariah-compliant insurance products in Malaysia, Singapore, the Philippines, Indonesia and Cambodia, according to its website."
2024-10-27,"KUALA LUMPUR: World No 4 Yin Ruoning shot a superb final-round 65 to win her second tournament in three weeks at the US LPGA Tour’s Maybank Championship in Malaysia on Sunday. The 22-year-old No 1-ranked Chinese golfer Yin is in red-hot form on the LPGA Tour’s Asian swing, having won her home Buick Shanghai title a fortnight ago and finishing tied 14th at the BMW Championship in South Korea last weekend. She took her third win of 2024 at the Kuala Lumpur Golf and Country Club by finishing on 23-under 265, a stroke clear of Thailand’s Jeeno Thitikul. Yin, Jeeno. and South Korea’s Ryu Hae-ran all began the final day tied for the lead at 16-under par, but it was Yin who got over the line with a seventh birdie of her round at the final hole to complete a bogey-free card. Ryu finished a stroke further back third on 21-under par. “I was pretty nervous,” admitted the former world No 1 Yin. “I really, really appreciated Haeran and Jeeno. They bring the best out of me. “Just another great day on the course and another great day with my friends.” She attributed her superb late-season form to mental strength and becoming able to handle anxiety. “I would say I learnt a lot from early this year because I was pretty stressed,” said Yin. “I had such a great last year and I was wondering if I could win again. “But I think I just really learned that I just need to enjoy myself out there and have fun.” Yin started well with two birdies in her first three holes. She holed two more at the sixth and seventh before securing a two-shot advantage with a beautiful approach on the 10th. She gained another shot to par at the 12th and sealed victory with her 25th birdie of the week on the final hole. Jeeno had to settle for second place for the second year in a row, having lost in a playoff to Celine Boutier last year. The 21-year-old said she never doubted that Yin would make her final birdie putt from 1.2m to secure the title. “She never missed a putt from that distance in the two days I played with her. So I knew she was going to make it,” said Jeeno. “She played four rounds of incredible golf, so the trophy belongs to someone who made fewer mistakes.”"
2024-10-25,"KUALA LUMPUR: Maja Stark shot a second consecutive round of 66 to take the 36-hole lead at the Maybank Championship in Kuala Lumpur. The Swede collected seven birdies and a bogey at Kuala Lumpur Golf and Country Club, driven by consecutive birdies from No 10 to 13. She carded par on the five remaining holes to take a one-shot lead at 12-under 132 for the tournament. “It went very well. I think I was pretty solid off the tee,” Stark said. “Had a lot of short irons. Then it was – I’ve been struggling a bit with my putting this whole year, but I feel like I really had an easier time seeing the lines here than I usually do.” Four players are one shot back at 11-under, and two more two shots back. Players had to battle weather on Friday, with conditions reaching almost 33C and a two-hour delay in the afternoon. Stark, 24, is seeking her second LPGA Tour win and first since 2022. She has three top-10 finishes in her past 18 starts, including back-to-back second-place finishes in April. Over the first two rounds, she is first with 14 birdies, but she has an eager group of players one shot back: Marina Alex (64 on Friday), South Koreans Narin An (67) and Haeran Ryu (69), and Wei-Ling Hsu (68) from Taipei. Alex posted a bogey-free round that included six birdies and an eagle on No 17 to catapult from 26th place after the first round. She spent the past three weeks at home in Florida, working with her coaches, and said the time away was valuable. “The season is super long. This will already have been my 20th event, so depending on how the rest of the season plays out, could be upwards of 25. That’s a lot of golf,” she said. “I mean, I think that players are playing a lot more and so it’s good to be mindful of taking a little time off.” South Korea’s Hye-Jin Choi (66) and Ruoning Yin of China (67) sit two shots back. First-round leader Mao Saigo on Japan slid to T13 after a 74 on Friday, following her opening-round 63."
